{
  "vector_version": 1,
  "hash_algorithm": "keccak256",
  "integer_encoding": "fixed-width-big-endian",
  "source_identity": {
    "network_name": "zkVerify Volta",
    "genesis_hash": "0xff7fe5a610f15fe7a0c52f94f86313fb7db7d3786e7f8acf2b66c11d5be7c242",
    "runtime_spec_name": "tzkv-runtime",
    "runtime_spec_version": 2000000,
    "runtime_transaction_version": 1,
    "runtime_state_version": 1,
    "runtime_code_hash": "0xb92a5248ec0772a456d91bd7e20c078dc64bf7c4809aa3d48821eb029325e33e"
  },
  "authorization": {
    "signer_set_epoch": 1,
    "source_network_id": "0x63f64f53339e0cfb288c57b0091f4932fa3181361fa87ba1dc583fbc172d836e",
    "source_genesis_hash": "0xff7fe5a610f15fe7a0c52f94f86313fb7db7d3786e7f8acf2b66c11d5be7c242",
    "source_runtime_id": "0x7f98ae91ea34aff20365f8f157636ea7b2eccd216212dca424ca4bce2b2b9a8b",
    "verification_context_hash": "0x676acbc40b7c7b5ba646aee26dd77984104e0674391ebd9f8e70b60d84ca6660",
    "domain_id": 2,
    "source_block_number": 6726351,
    "source_block_hash": "0xb995cd3981fb8013be45d89009aa360a338935e4ec9feb8e653e7d724af9206c",
    "aggregation_id": 53668,
    "root": "0x7c609ffcf63004e1203188d6fbed6f5431fa344d6f90990c2c45a6db3bbc466e",
    "leaf_count": 1,
    "authorization_nonce": 1
  },
  "configured_signers": [
    "0x2b5ad5c4795c026514f8317c7a215e218dccd6cf",
    "0x6813eb9362372eef6200f3b1dbc3f819671cba69",
    "0x7e5f4552091a69125d5dfcb7b8c2659029395bdf"
  ],
  "threshold": 2,
  "attesting_signers": [
    "0x2b5ad5c4795c026514f8317c7a215e218dccd6cf",
    "0x6813eb9362372eef6200f3b1dbc3f819671cba69"
  ],
  "attesting_signatures": [
    "0x24e99c2e886dc9580021cbcfca9c50834283f9a0d87e5b4655540e48c1db674c0dc25336adb16930c8dc3eea3e9dfe7bd3f64f7709567d3522867977b83141d71b",
    "0x927c2ddb8fe7c6c5b683b28ec064bb32bfcacbc85e7d95c62e10dc03e6fec905547b94007288034de16fd961e9c3d631b0f755805ca60433fd386a55b490992f1c"
  ],
  "receipt_fixture": {
    "statement": "0xb4b058ae36bcc8357241b0c308630d7ba203bd47726edbad5ed16b04afeb8492",
    "leaf_index": 0,
    "merkle_path": []
  },
  "pfr_only_digest": "0xa5a5ed3ac2ad0b61efdebcc8f9db1a020cb20fd186e2ea3657c747cb0aec5df7",
  "pfr_only_signer": "0x1eff47bc3a10a45d4b230b5d10e37751fe6aa718",
  "pfr_only_signature": "0x6457db3ee18bd1c13829af54553c95862e87362a325989a42352b262169ab3734c6061fa290797f2a90c6e19f51d82259d8e52d6a60138324f770a2df170f5e71c",
  "settlement_claim_fixture": {
    "raw_statement": "0x01000100010001001f0000001800000000000000000000000000000000000000abde249a257cd4e6c3ed34f2749a7d8be66fd418f5a5d8595bffc956b45f0e0088957f2aa94f0f483d11f6bbc00b37db9fedd7911eee56e15c1661e14845320088957f2aa94f0f483d11f6bbc00b37db9fedd7911eee56e15c1661e14845320005000000000000000000000000000000000000000000000000000000000000004cc6356134cfb0dcefee384334580a10c3f82929f64a9f8833dd47ebc2cdbf00",
    "route_id": "0x27b40b99a41976f061e94124b84cc8c43ee4e5ed6bad2e94267057e1d375f2ef",
    "primary_transition_id": "0x959550f3847e15ae2d69ab027d8ef59621282eeb758746262205fa3f61b38721",
    "source": "0x63f64f53339e0cfb288c57b0091f4932fa3181361fa87ba1dc583fbc172d836e",
    "destination_chain_id": 84532,
    "destination_consumer": "0x0000000000000000000000000807c544d38ae7729f8798388d89be6502a1e8a8",
    "action_kind": "membership",
    "checkpoint": 6726351,
    "session_id": "0xb995cd3981fb8013be45d89009aa360a338935e4ec9feb8e653e7d724af9206c",
    "bvc_id": "0x676acbc40b7c7b5ba646aee26dd77984104e0674391ebd9f8e70b60d84ca6660",
    "accepted_root": "0x88957f2aa94f0f483d11f6bbc00b37db9fedd7911eee56e15c1661e148453200",
    "state": "committed",
    "signer_set_epoch": 7,
    "issuance_height": 6726351,
    "supersedes_record_id": null
  },
  "negative_cases": [
    {
      "id": "zero_configured_signer",
      "initial_state": "empty",
      "operation": "construct_policy",
      "field": "configured_signers",
      "value": {
        "kind": "signer_array",
        "data": [
          "0x0000000000000000000000000000000000000000",
          "0x6813eb9362372eef6200f3b1dbc3f819671cba69",
          "0x7e5f4552091a69125d5dfcb7b8c2659029395bdf"
        ]
      },
      "expected_error": "ZeroConfiguredSigner",
      "before_state_digest": "0xbac9097df303d0e7917f556a919e5b6a11f5c86af2ae25836e0830c639578459",
      "after_state_digest": "0xbac9097df303d0e7917f556a919e5b6a11f5c86af2ae25836e0830c639578459"
    },
    {
      "id": "duplicate_configured_signer",
      "initial_state": "empty",
      "operation": "construct_policy",
      "field": "configured_signers",
      "value": {
        "kind": "signer_array",
        "data": [
          "0x2b5ad5c4795c026514f8317c7a215e218dccd6cf",
          "0x2b5ad5c4795c026514f8317c7a215e218dccd6cf",
          "0x7e5f4552091a69125d5dfcb7b8c2659029395bdf"
        ]
      },
      "expected_error": "DuplicateConfiguredSigner",
      "before_state_digest": "0xbac9097df303d0e7917f556a919e5b6a11f5c86af2ae25836e0830c639578459",
      "after_state_digest": "0xbac9097df303d0e7917f556a919e5b6a11f5c86af2ae25836e0830c639578459"
    },
    {
      "id": "unsorted_configured_signers",
      "initial_state": "empty",
      "operation": "construct_policy",
      "field": "configured_signers",
      "value": {
        "kind": "signer_array",
        "data": [
          "0x6813eb9362372eef6200f3b1dbc3f819671cba69",
          "0x2b5ad5c4795c026514f8317c7a215e218dccd6cf",
          "0x7e5f4552091a69125d5dfcb7b8c2659029395bdf"
        ]
      },
      "expected_error": "ConfiguredSignersNotSorted",
      "before_state_digest": "0xbac9097df303d0e7917f556a919e5b6a11f5c86af2ae25836e0830c639578459",
      "after_state_digest": "0xbac9097df303d0e7917f556a919e5b6a11f5c86af2ae25836e0830c639578459"
    },
    {
      "id": "invalid_threshold",
      "initial_state": "empty",
      "operation": "construct_policy",
      "field": "threshold",
      "value": {
        "kind": "u16",
        "data": 4
      },
      "expected_error": "InvalidThreshold",
      "before_state_digest": "0xbac9097df303d0e7917f556a919e5b6a11f5c86af2ae25836e0830c639578459",
      "after_state_digest": "0xbac9097df303d0e7917f556a919e5b6a11f5c86af2ae25836e0830c639578459"
    },
    {
      "id": "zero_recovered_signer",
      "initial_state": "empty",
      "operation": "register_evm_call",
      "field": "signatures",
      "value": {
        "kind": "signature_array",
        "data": [
          "0x00000000000000000000000000000000000000000000000000000000000000000dc25336adb16930c8dc3eea3e9dfe7bd3f64f7709567d3522867977b83141d71b"
        ]
      },
      "expected_error": "ZeroAttester",
      "before_state_digest": "0xbac9097df303d0e7917f556a919e5b6a11f5c86af2ae25836e0830c639578459",
      "after_state_digest": "0xbac9097df303d0e7917f556a919e5b6a11f5c86af2ae25836e0830c639578459"
    },
    {
      "id": "duplicate_recovered_signer",
      "initial_state": "empty",
      "operation": "register_evm_call",
      "field": "signatures",
      "value": {
        "kind": "signature_array",
        "data": [
          "0x24e99c2e886dc9580021cbcfca9c50834283f9a0d87e5b4655540e48c1db674c0dc25336adb16930c8dc3eea3e9dfe7bd3f64f7709567d3522867977b83141d71b",
          "0x24e99c2e886dc9580021cbcfca9c50834283f9a0d87e5b4655540e48c1db674c0dc25336adb16930c8dc3eea3e9dfe7bd3f64f7709567d3522867977b83141d71b"
        ]
      },
      "expected_error": "DuplicateAttester",
      "before_state_digest": "0xbac9097df303d0e7917f556a919e5b6a11f5c86af2ae25836e0830c639578459",
      "after_state_digest": "0xbac9097df303d0e7917f556a919e5b6a11f5c86af2ae25836e0830c639578459"
    },
    {
      "id": "unsorted_recovered_signers",
      "initial_state": "empty",
      "operation": "register_evm_call",
      "field": "signatures",
      "value": {
        "kind": "signature_array",
        "data": [
          "0x927c2ddb8fe7c6c5b683b28ec064bb32bfcacbc85e7d95c62e10dc03e6fec905547b94007288034de16fd961e9c3d631b0f755805ca60433fd386a55b490992f1c",
          "0x24e99c2e886dc9580021cbcfca9c50834283f9a0d87e5b4655540e48c1db674c0dc25336adb16930c8dc3eea3e9dfe7bd3f64f7709567d3522867977b83141d71b"
        ]
      },
      "expected_error": "AttestersNotSorted",
      "before_state_digest": "0xbac9097df303d0e7917f556a919e5b6a11f5c86af2ae25836e0830c639578459",
      "after_state_digest": "0xbac9097df303d0e7917f556a919e5b6a11f5c86af2ae25836e0830c639578459"
    },
    {
      "id": "nonmember_recovered_signer",
      "initial_state": "empty",
      "operation": "register_evm_call",
      "field": "signatures",
      "value": {
        "kind": "signature_array",
        "data": [
          "0x4447e6dd35042c316114a4f4dd4e0c3454bdc29e2d4b87c73127cf82cd27530a53a90e348485d63261eceea31afc801dd5f6f3e1af3fc90cf5f712b196bd24631c"
        ]
      },
      "expected_error": "UnauthorizedAttester",
      "before_state_digest": "0xbac9097df303d0e7917f556a919e5b6a11f5c86af2ae25836e0830c639578459",
      "after_state_digest": "0xbac9097df303d0e7917f556a919e5b6a11f5c86af2ae25836e0830c639578459"
    },
    {
      "id": "below_threshold",
      "initial_state": "empty",
      "operation": "register_evm_call",
      "field": "signatures",
      "value": {
        "kind": "signature_array",
        "data": [
          "0x24e99c2e886dc9580021cbcfca9c50834283f9a0d87e5b4655540e48c1db674c0dc25336adb16930c8dc3eea3e9dfe7bd3f64f7709567d3522867977b83141d71b"
        ]
      },
      "expected_error": "BelowThreshold",
      "before_state_digest": "0xbac9097df303d0e7917f556a919e5b6a11f5c86af2ae25836e0830c639578459",
      "after_state_digest": "0xbac9097df303d0e7917f556a919e5b6a11f5c86af2ae25836e0830c639578459"
    },
    {
      "id": "zero_r_signature",
      "initial_state": "empty",
      "operation": "recover_signature",
      "field": "signatures",
      "value": {
        "kind": "signature_array",
        "data": [
          "0x00000000000000000000000000000000000000000000000000000000000000000dc25336adb16930c8dc3eea3e9dfe7bd3f64f7709567d3522867977b83141d71b"
        ]
      },
      "expected_error": "InvalidSignature",